Indicator ID,Challenge Area,Challenge Sub-Area,Challenge Component,Dataset,Dataset Link,Data Producer,Year,Value Max,Indicator Title,Indicator Question,Region,Country Name,Benchmark ID,Country Code,Response Num,Response Text,Source Text,Response Notes
ac_ei_bo,Anti-Corruption,Extractives,NA,EITI Validation Data,,Extractive Industries Transparency Initiative (EITI),2025,2,Benefical Ownership,Transparency of who owns and controls the country’s extractive industries,Africa and the Middle East,Nigeria,ac_ei_04,NGA,1,Partial,Mostly met,"The Secretariat’s assessment is that Requirement 2.5 is mostly met. Opinions of stakeholders consulted were split over the level of progress in meeting the objective of enabling the public to know who ultimately owns and controls all companies operating in the country’s extractive industries. Many stakeholders consulted from all constituencies expressed pride at Nigeria launching Africa’s first EITI BO portal through NEITI in 2020. The early ownership disclosure work through NEITI had led the Bureau of Public Procurement to require beneficial ownership disclosure as part of its procurement process for government contracts. Several government officials considered that the objective was being fulfilled given the enactment of legal provisions requiring the public disclosure of beneficial ownership and that companies were in the process of complying with these obligations. While several stakeholders from all constituencies hailed the significant progress achieved to date, several CSOs and development partners consulted considered that data collection, the establishment of protocols for the automatic exchange of beneficial ownership data between different government agencies, and disclosures of beneficial ownership were still in progress. The NSWG’s comments on the draft Validation report argue for an upgrade in the assessment of Requirement 2.5 to ‘fully met’ based on its view that the objective has been fulfilled. Indeed, the comments argue that Nigeria has established a robust legal and regulatory framework for beneficial ownership transparency and that it has built on its launch of Africa’s first public beneficial ownership register through the CAC’s launch of its own public beneficial ownership portal covering companies operating in all economic sectors. The Secretariat’s view is that the objective is mostly met, given enactment of an enabling legal framework but the need for further progress in publicly disclosing the beneficial ownership of all companies holding or applying for extractive rights. It is possible to identify the names of companies that have yet to disclose their beneficial ownership by cross-referencing the list of beneficial owners from the NEITI BO portal with the full list of companies holding participating interests in licenses and contracts in the mining and petroleum sectors.  

There is an enabling legal and regulatory environment for the collection and public disclosure of beneficial ownership information of companies operating in all economic sectors through the 2020 amendments to the Companies and Allied Matters Act (CAMA), which requires the Corporate Affairs Commission (CAC) to establish a public beneficial ownership register. In the oil and gas sector specifically, the 2021 Petroleum Industry Act (PIA) requires the new Nigeria Upstream Petroleum Regulatory Commission (NUPRC) to maintain a public register of beneficial ownership of active oil and gas licenses, leases and permits. The amended CAMA provides a definition of ‘beneficial owner’ aligned with Requirement 2.5.f.i and sets a disclosure threshold of 5% of ownership or control. Although the CAMA does not provide a definition or specific disclosure requirements for politically exposed persons (PEPs), the 2022 Money Laundering (Prevention and Prohibition) Act provides a definition of PEPs. In addition, the 1990 Nigerian Code of Conduct and Tribunal Act requires senior government officials including politically exposed persons to disclose their assets and interests in companies. However, the lack of explicit provisions related to PEPs in the CAMA imply that PEPs are subject to the same 5% disclosure threshold as all other beneficial owners. The December 2022 regulation on “persons of significant control” include provisions for the disclosure of PEPs, albeit only for beneficial owners above the 5% threshold. The NSWG’s comments on the draft Validation report highlight the importance of support from the Opening Extractives programme in increasing political commitment and stakeholder awareness of beneficial ownership transparency.  

The 2020 amendments to CAMA require that beneficial ownership information be requested from all Nigerian companies. In oil and gas, the 2021 PIA requires that beneficial ownership data be collected from companies holding oil and gas rights but does not specify whether such ownership data should also be collected from companies applying or bidding (even unsuccessfully) for oil and gas rights. However, the requirement to disclose beneficial ownership data to the II was included in the pre-qualification requirements for the 2023 mini-bid round, according to government officials consulted. However, the lack of public disclosure of the full list of bidders for each oil and gas license awarded through bid round hinders the ability to check whether the beneficial ownership of unsuccessful license applicants has yet been publicly disclosed. While all applicants for licenses registered in Nigeria are required to disclose their beneficial ownership to the CAC, foreign companies operating in Nigeria that are able to apply for oil and gas licenses are required to obtain an exemption from the requirement to register with the CAC from the Ministry of Industry, Trade and Investment. There were different opinions among stakeholders consulted over whether exempted foreign companies would nonetheless be required to report their beneficial ownership to the CAC. In mining, the 2020 NEITI Solid Minerals Report notes that the Mining Cadastre Office (MCO) has required disclosure of beneficial ownership as part of the license award, renewal and transfer processes since the enactment of new guidelines for applications for mineral titles in 2019. In consultations, industry representatives explained that NNPC had started collecting beneficial ownership data as part of its due diligence of crude oil buyers and third-party vendors and suppliers, and that it was hoping to publish this data on the (new) NNPC website in future.  

The IAs preparing NEITI Reports on both solid minerals and oil and gas have requested beneficial ownership information from material companies included in the scope of reconciliation since piloting this approach in the 2012 NEITI Reports published in 2014. Stakeholder consultations confirmed that directives had been sent by the NUPRC and the MCO to all oil and gas companies and all solid minerals companies respectively, requesting all license- and contract-holders to report their beneficial ownership to the respective regulators within seven days. While lauding the efforts to collect data, one development partner consulted expressed scepticism at the efficacy of setting such a short deadline for disclosing beneficial ownership data and considered that a longer timeframe would be required for all companies to report. Consultations confirmed that beneficial ownership data had been consistently requested from applicants for new mining, oil and gas licenses and contracts since 2022. A senior government official explained that while the PIA did not require beneficial ownership disclosures from applicants for oil and gas licenses that were not successful in their application for a license, the request for beneficial ownership disclosure had been incorporated into recent bid round pre-qualification procedures.  

The CAC and the NUPRC launched their public beneficial ownership registers in January 2023, although the NUPRC’s NOGABOR portal does not currently list any beneficial ownership data. The CAC portal lists the beneficial ownership (listed as ‘persons of significant control’) of companies incorporated since the start of 2022 but does not yet publish ownership data for most companies registered prior to the enactment of the 2020 CAMA amendments. The NEITI BO portal presents the most extensive beneficial ownership disclosures of extractives companies thus far, although this includes only partial ownership disclosures by those extractives companies that chose to report such information to NEITI. This is confirmed in a 2021 FATF assessment of Nigeria, which concluded that the CAC “does not maintain timely, adequate, accurate and up-to-date BO information”. While the CAC ownership portal has developed an API to push data to a planned 23 government agencies in due course (it has connected to a handful of agencies as of the time of this Validation), there is no automatic exchange of information between the three separate beneficial ownership portals operated by the CAC, NUPRC and NEITI respectively. This has resulted in distinct non-coordinated data collection efforts and three portals that have differing levels of ownership information on different companies.  

A fourth, non-public, register of beneficial owners is being developed by the Mining Cadastre Office, which has used beneficial ownership data collection since 2019 as a means of driving revenue growth (doubling revenues to NGN 4.3bn (around USD 9.8m) through the identification of mineral title holders seeking to avoid payment of outstanding debts by abandoning old licenses and applying for new licenses using newly formed companies, as noted in the 2022 Opening Extractives Policy Brief. However, the planned MCO’s beneficial ownership register does not appear to be integrated into the other BO registers.  

In December 2022, NEITI published a review of the comprehensiveness and reliability of beneficial ownership data disclosures to date. The review focused on the status of beneficial ownership disclosures for 2020, noting that a total of 254 extractive companies had reported their beneficial ownership information to NEITI. There are different estimates of the number of companies reporting their beneficial owners to NEITI, between 76 mining companies and 31 oil and gas companies listed in the 2020 NEITI Reports to estimates from development partners that a total of 199 extractive companies had reported their beneficial ownership to NEITI as of 2023. As of January 2023, a total of 303,700 companies in all economic sectors (out of a total of around 3.5m registered companies in Nigeria) have reported their beneficial ownership to the CAC, yielding information on a total of 628 beneficial owners of extractive companies reported to NEITI and the CAC combined. However, there appear to be instances of disclosure of legal owners as ‘beneficial owners’ in both the NEITI BO portal and the CAC portal. A government official explained that the CAC was following up with all companies registered prior to 2021 to collect data on their beneficial ownership, but that it had not yet set a timeline for enforcing sanctions against non-complying companies in line with the CAC’s PSC regulations of 2022. A development partner called for the CAC to start naming and shaming companies that did not report their beneficial ownership and ‘naming and faming’ those that did, particularly companies registered prior to 2021. The IAs for the 2020 NEITI Reports noted that they had not consulted with the CAC in preparing the reports. The IA explained that many companies listed on the CAC portal were marked as having no person of significant control, because the CAC was still awaiting this information. The NSWG’s comments on the draft Validation report emphasise that government entities have been implementing the beneficial ownership regulations by requesting ownership data from companies. They also note that Nigeria has advanced the implementation of ownership transparency through capacity building for stakeholders to use the ownership data in anti-corruption and sector reform efforts. The comments highlight evidence of civil society and media use of beneficial ownership data. The NSWG also argues that the gaps in availability of beneficial ownership of some companies will remain perpetually and therefore that the lack of beneficial ownership information on certain extractives companies should not be considered a gap in this Validation. The Secretariat recognises that efforts to ensure comprehensive disclosures of beneficial ownership data on extractives companies will involve a continuous process. Nonetheless, the Secretariat’s assessment that Requirement 2.5 remains mostly met is based on the relatively large number of companies holding or applying for extractive rights for whom beneficial ownership information has not yet been published. In addition, several of the companies for whom beneficial ownership data is not yet publicly available appear to be ‘high risk’.  

The NEITI Report appendices do not provide the name of stock exchanges where publicly listed extractive companies trade nor links to their statutory filings for all extractive companies, with only the 2020 NEITI Oil and Gas Report providing this information for some, but not all, subsidiaries of publicly listed companies. However, this information and more is required of state-owned companies and subsidiaries of publicly listed companies to be publicly disclosed in the PSC regulations enacted by the CAC in 2022. Information on legal ownership of mining, oil and gas companies is available through the CA’'s Company Register for a fee of NGN 1,000 (around USD 2.2) per corporate record. Government officials consulted explained that the CAC was currently digitising its corporate records, to enable the online portal to list legal owners of companies. There are discrepancies in the information on company legal ownership between the NEITI BO Register and the CAC Company Register.  "
ac_ei_bo,Anti-Corruption,Extractives,NA,EITI Validation Data,,Extractive Industries Transparency Initiative (EITI),2025,2,Benefical Ownership,Transparency of who owns and controls the country’s extractive industries,Europe,Norway,ac_ei_04,NOR,1,Partial,Partly met,"The Secretariat’s assessment is that Requirement 2.5 is partly met, as in the previous Validation. While there has been progress in the building of the actual register, the register will not include information on Politically Exposed Persons (PEPs), and there is no significant improvement in terms of actual disclosures and public review of available information.   

Legislation establishing an ultimate beneficial ownership registry was enacted in March 2019, and came into force in June 2021, with the exception of chapters on submissions, verification, and fines. As assessed in the previous Validation on beneficial ownership, this definition of beneficial owners is aligned with the EITI Standard, and includes a clear ownership threshold of 25%, applicable to a broader group of business entities than required by the EITI Standard. Listed companies are exempt, and the stock exchanges where EITI reporting companies are listed are identified in the transparency template submitted by NOR-EITI as part of this Validation but are not disclosed elsewhere. 

Public access: The roll-out of the register is planned in three phases, beginning with the launch of the submission form and the register on 1 January 2023, and the collection of data through the government portal on which taxes and company registrations are managed (altinn.no). Phase two is expected to include an expansion of ownership forms, and follow up with businesses that have submitted, and after all companies are included in the register, the administration of fines for non-compliance. Phase three, expected to commence in January 2024, would link the Norwegian register to other European beneficial ownership registers. In its response to the draft Validation Report, the MPE stated that the delay in public disclosures were linked to the European Court of Justice ruling to the publication of BO data. The Government issued a statement that it is reviewing the public access of the register. In its response, the International Secretariat underlined that Norway is free to choose how to publish beneficial owners. While a public register is encouraged, it is not necessary to have such a register in place to satisfy this requirement. As of February 2023, there are no comprehensive disclosures of beneficial owners of all companies holding or applying for extractive licenses. 

Legal ownership data can currently be accessed in the national business registry (enhetsregisteret), by requesting information directly from companies,  and via the tax department’s website, whose shareholder register contains shareholder information for all limited liability companies registered in Norway or on the Oslo stock exchange. This information is updated annually and available on request at no cost. A desk review found this registry included all but three EITI reporting companies.   

Politically exposed persons (PEPs) will not be specifically designated in the register or systematically collected. Though information on PEPs is required for customer due diligence by the Act relating to Measures to Combat Money Laundering and Terrorist Financing (the Anti-Money Laundering Act), consultations suggest that this is the responsibility of individual banks. In a letter dated September 2022 to oil and gas companies, the Ministry of Petroleum and Energy requested companies who hold a licence or are prequalified, to publish on their website any persons who own or control the company that are PEPs. It is unclear if the companies have complied with that request. 

Verification of data: At the time of Validation, no data has been collected or verified. Consultations suggest that data entered via forms will be crosschecked against the population register and the company register (based on the ID numbers entered), and that mechanisms for addressing missing data in phase two have not yet been determined. There is no legal basis for verifying the accuracy of data, and consultations suggested no clear administrative plans to do so.  

The reliability and comprehensiveness of beneficial ownership information is quite limited. The transparency template submitted by NOR-EITI as part of this validation notes that privately held EITI reporting companies hold 15% of all oil and gas licences (213 of 1454). Legal ownership information is available for most of these, but not beneficial ownership information or information on PEPs. There is no designated body to review this data, or evidence of an assessment by NOR-EITI in keeping with Requirement 2.5(e).  "
ac_ei_bo,Anti-Corruption,Extractives,NA,EITI Validation Data,,Extractive Industries Transparency Initiative (EITI),2025,2,Benefical Ownership,Transparency of who owns and controls the country’s extractive industries,Asia and the Pacific,Papua New Guinea,ac_ei_04,PNG,1,Partial,Partly met,"The Secretariat’s assessment is that Requirement 2.5 is partly met. The objective of the requirement is far from being fulfilled. 
Requirement 2.5 is intended to enable the public to know who ultimately owns and controls the companies operating in the country’s extractive industries, and requires disclosures and actions according to two phases. As of 1 January 2022, the requirement is assessed in accordance with Phase 2 (see Validation Guide).
In regard to Phase 1, the MSG has agreed on an appropriate, publicly available definition of the term beneficial owner that is aligned with Requirement 2.5.f.i, as presented in the Beneficial Ownership Disclosure Report that was published December 2020 (page 53-54). This report also included a template form for requesting beneficial ownership information from companies, which was sent to all companies holding or applying for licenses, and which included all of the information required by the EITI Standard, including names, nationalities, countries of residences, and recommended information such as national identity numbers, dates of birth and means of contact. The BOD Report also identified several gaps, and implementation of the Report’s recommendations is included as an activity line in the PNGEITI work plans for 2021 and 2022, though no detailed activities are included. 
The content of the 2020 BOD report has not been matched by corresponding advances in government policy or practice. There is currently no government policy on beneficial ownership, and though definitions of beneficial owners have been proposed for inclusion in amendments to legal documents, the definitions included in the Income Tax Act amendment (9th draft) did not correspond with the definition required by the EITI 2019 Standard. 
Stakeholders consulted for this Validation consistently noted that PNG’s current regulatory framework is oriented towards shareholder information, and not beneficial ownership as understood in the EITI Standard. This also the case for the 2019 EITI Report, which discloses shareholder structure information of companies, not beneficial ownership.  Though work is underway for a new company registry, stakeholder expect that this too will be oriented towards information on company shareholders, in keeping with PNG law. Comprehensive information about the legal owners of extractive companies is currently not publicly available in PNG. It is not clear which extractive companies are publicly listed or wholly owned subsidiaries of publicly listed companies, although the BOD Report and the 2019 EITI Report map the ownership structure of some companies.
Though the disclosure form annexed to the 2020 Report had been shared with the IPA, no stakeholders consulted during this Validation were aware of any specific actions taken by the IPA towards using or adapting that form.  In regard to Phase 2, no steps or disclosures have been made. The MSG has not developed a specific strategy for addressing legal obstacles to beneficial ownership in PNG, or implementing the action plan and recommendations of the 2020 Report more generally. 
The MSG argued in its feedback on the draft Validation report that the requirement should be assessed as Mostly met. The MSG noted that legal reforms enabling BO disclosure will take time and that the COVID-19 pandemic has slowed down follow-up on the BO study. It also noted that the MSG had established a technical working group to address beneficial ownership transparency and to follow up on the recommendations of the BO study. The Secretariat commends this forward-looking commitment. In light of available information and the Validation Guide, it continues to consider the requirement as Partly met."
