Indicator ID,Challenge Area,Challenge Sub-Area,Challenge Component,Dataset,Dataset Link,Data Producer,Year,Value Max,Indicator Title,Indicator Question,Region,Country Name,Benchmark ID,Country Code,Response Num,Response Text,Source Text,Response Notes
ac_ei_contracts,Anti-Corruption,Extractives,NA,EITI Validation Data,,Extractive Industries Transparency Initiative (EITI),2025,2,Contracts and licenses,Public accessibility of all licenses and contracts underpinning extractive activities,Africa and the Middle East,Burkina Faso,ac_ei_03,BFA,1,Partial,Mostly met,"The Secretariat’s assessment is that Requirement 2.4 is mostly met. Many contracts, including pre-dating 1 January 2021, and all licenses seem to be published according to the law, which explicitly mandates the publication of licenses and contracts. Burkina Faso did not maintain an overview of all active contracts during the period reviewed by the draft Validation report, but the MSG published a list of active licenses and contracts at end 2022 during the period for comments on the draft Validation report. However, the Secretariat's document review indicates that not all contracts since 1 January 2021 appear to have been published yet.  

Article 15 of the 2015 Mining Code explicitly mandates the publication of all mining licences and contracts via the official gazette (Journal official). As the gazette is not available electronically70 EITI-BF has published licences and contracts on the EITI national website.71 A sample check showed that the full text of some licences that were allocated in December 2022 and January 2023 (as listed in the online cadastre) have been published on the Burkina Faso website. All extractives contracts except for one appear to include all annexes (for those checked). Disclosures include contracts and licenses signed before January 2021, dating back to 2003. Most contracts include the licence as annex, but licences are published separately as well on the EITI-BF website. A comparison between the list of active mines published in the statistical bulletin in December 2022 and the list of published contracts on EITI-BF show that 18 contracts of the 27 active mining projects have been published. There is no evidence that the MSG has considered the materiality of exploration licenses, although the Secretariat notes that the government’s disclosure policy covers both exploration and production rights. In its comments on the draft Validation report, the MSG highlighted the publication of the 18 contracts on the EITI-BF website, and noted that all contracts and licenses had been published in the official gazette. While the Secretariat recognises the EITI-BF work in improving access to the 18 key mining contracts, it has also faced challenges in accessing the full text of other mining licenses and contracts published in the official gazette (journal official). 

Several of the mining sites listed as active have expired permits. These could have been renewed, but this is not reflected in the cadastre or the published contract. The 2021 contract disclosure plan72 presents a costing of the activities that led to the disclosure of the full text of licenses and contracts to the EITI-BF website, and the result is a rich compilation of documents. However, the plan does not include a list or an overview of all contract and licenses currently active or identify what amendments have been made to which contracts and licenses. This represents an obstacle to the overall objective of ensuring the public’s understanding of the contractual rights of extractive companies, particularly considering the high amount of awards/cancellation of mining rights in the country.  "
ac_ei_contracts,Anti-Corruption,Extractives,NA,EITI Validation Data,,Extractive Industries Transparency Initiative (EITI),2025,2,Contracts and licenses,Public accessibility of all licenses and contracts underpinning extractive activities,Americas,Colombia,ac_ei_03,COL,2,Yes,Fully met,"The Secretariat's assessment is that Requirement 2.4 is fully met. When consulted, industry and civil society stakeholders considered that the objective of contract transparency had been fulfilled. While Law 1712 of 2014 provides for certain economic rights information contained in documents that are not considered to be part of oil and gas contracts cannot be disclosed by law, as clarified in the government and EITI Colombia Secretariat’s comments on the draft Validation report. The Secretariat’s view is that the objective of Requirement 2.4 is fully met given that all active contracts and licenses appear to have been disclosed. In its comments on the draft Validation report, civil society acknowledged the important advances in contract transparency but highlighted the continued challenges in accessing and understanding contracts by stakeholders at the subnational level. Further improvements in the accessibility of contracts and licenses could help improve their use by a broader range of stakeholders.  

Relevant government policy on contract and license disclosure in the mining and oil and gas sectors is summarized in the 2020 EITI Report and links are provided to where the full text of these laws and regulations can be found on government websites. Government policy is in favour of contract and license disclosure, although there are legal constraints to publicly disclosing economic information that is not considered part of the contract. The redacted information consists of data that, if disclosed, is alleged by government and industry stakeholders to be harmful to natural persons or legal entities and proprietary technical information, such as variables used to calculate the economic contributions of extractive projects. However, this explanation of the rationale for redacting portions of published contracts has not yet been published. In practice, the ANH and ANM provide lists of all active licenses and contracts (including those awarded prior to 1 January 2021), as well as the full text, with annexes, amendments and riders other than what is expressly prohibited. It appears that the Colombian government has made great efforts to publish contracts in the mining sector and the concession contract webpage hosted by the ANM appears to publish the full text of numerous mining contracts. EITI reporting provides figures for each type of active mining contract and license and includes a link to where the text of these contracts and licenses are found on the ANM website. While there is no comprehensive review of which contracts and licenses are published (including annexes, amendments and riders in accordance with Requirement 2.4.c.ii) all contracts and licenses appear to be published on the ANM and ANH websites according to all stakeholders consulted. There does not appear to be an established plan in place to further improve the accessibility of published contracts and licenses.  "
ac_ei_contracts,Anti-Corruption,Extractives,NA,EITI Validation Data,,Extractive Industries Transparency Initiative (EITI),2025,2,Contracts and licenses,Public accessibility of all licenses and contracts underpinning extractive activities,Africa and the Middle East,Cote d'Ivoire,ac_ei_03,CIV,1,Partial,Mostly met,"The Secretariat’s assessment is that Côte d’Ivoire has mostly met Requirement 2.4. While stakeholders highlighted that many oil and gas contracts had been published, most of the mining contracts and licenses remain to be disclosed. In addition, there had been no systematic review of publications of contracts and licenses in the extractive sector. Mining contracts and licenses are yet to be published, and some stakeholders considered the lack of publication in the mining sector as problematic. The 2019 EITI Report provides an overview of the applicable legal framework for extractive contract and license disclosure. The legal framework largely supports public dissemination of the contents of licenses and contracts. Hence, there do not appear to be explicit legal barriers to contract transparency. Given that extractive contracts are awarded by laws and extractive licenses awarded by decree, the publication of the full text of these documents is required in the official gazette (journal officiel). After the start of the Validation, in November 2022, the seven oil and gas contracts signed between January 2019 and July 2022 have been made public through a special edition. It includes the full text of the contract, as well as amendments and annexes. This publication has been unanimously welcomed by stakeholders engaged in the extractive sector. Several others production sharing contracts are also available through the national EITI website. However, in the absence of a comprehensive review of all active contracts and licenses with references to where each license is publicly accessible, it is difficult to conclude whether all documents have been published. An overview or a list of all active contracts and licenses, including exploration contracts, indicating which contracts and licenses are publicly available, and which are not, does not appear to be yet publicly available. In its response to the draft Validation Report, the MSG, confirmed that oil contracts signed since 2019 have been published in the Official Journal and on the national EITI website. In the mining sector, all mining production contracts concluded since 2019 have been transferred to the Secretariat General of the Government for publication, and copies have been published by Côte d’Ivoire EITI . However, these disclosures seem to only include production, not exploration, licenses and contracts."
ac_ei_contracts,Anti-Corruption,Extractives,NA,EITI Validation Data,,Extractive Industries Transparency Initiative (EITI),2025,2,Contracts and licenses,Public accessibility of all licenses and contracts underpinning extractive activities,Americas,Dominican Republic,ac_ei_03,DOM,2,Yes,Exceeded,"The Secretariat's assessment is that Requirement 2.4 is exceeded. 
The objective of this requirement is to ensure the public accessibility of all 
licenses and contracts underpinning extractive activities (at least from 2021 
onwards) as a basis for the public’s understanding of the contractual rights and 
obligations of companies operating in the country’s extractive industries. The 
Secretariat considers that the objective has been exceeded given that full 
license and contract transparency is written into Dominican Republic’s 
constitution and is fully complied with in practice.
The Dominican Republic EITI has documented relevant government policy on 
license and contract disclosure for mining and hydrocarbons and mapped out 
relevant laws and regulations. All contracts in the oil and gas sector and all 
contracts and licenses in the mining sector, including annexes, amendments
and riders, have been systematically disclosed on the MEM website and are 
well-summarised through EITI reporting. The MEM website provides 
comprehensive lists of all active contracts and licenses in the mining, oil and 
gas sectors, indicating which contracts and licenses have been published, 
which is all of them. The 2020 EITI Report provides links to where these 
contracts and licenses can be viewed in full on the mining and oil and gas
transparency portals. Contracts and licenses published before 1 January 2021 
are also published in full."
ac_ei_contracts,Anti-Corruption,Extractives,NA,EITI Validation Data,,Extractive Industries Transparency Initiative (EITI),2025,2,Contracts and licenses,Public accessibility of all licenses and contracts underpinning extractive activities,Americas,Ecuador,ac_ei_03,ECU,1,Partial,Mostly met,"The International Secretariat's assessment is that Requirement 2.4 is mostly met. There is no explicit government policy on contract and license disclosure and disclosure practices do not follow a set procedure, which limits fulfilment of the objective of ensuring the public accessibility of all licenses and contracts underpinning extractive activities (at least from 2021 onwards) as a basis for the public's understanding of the contractual rights and obligations of companies operating in the country's extractive industries. The Secretariat considers that the objective has been only mostly fulfilled given a lack of clarity and MSG discussion on the government's position on contract transparency and a lack of comprehensive disclosure of all extractive contracts and licenses, despite improving publication practices of petroleum contracts. In their comments to the draft Validation report, government stakeholders considered that there was no need for a specific law on contract transparency given that they considered that mining contracts are published in practice, although it is not clear whether all mining contracts have in fact been published. International development partners agreed with the Secretariat’s assessment that there should be documented MSG discussions on where government policy on contract disclosure is embodied. 

Ecuador EITI has not documented relevant government policy on license and contract disclosure for mining and hydrocarbons and international development stakeholders confirmed that there is not a centralised policy on contract disclosure. It is not clear from EITI reporting where government policy on contract disclosure is embodied given the lack of focused legislation on this matter. While numerous pre- and post-2021 contracts have been disclosed in the hydrocarbons sector, it is not clear where the impetus for this disclosure came from or whether it will continue. International development stakeholders noted that there had been even more pre-1 January 2021 oil and gas contracts that had been disclosed but that they were not migrated to new government websites when these websites were updated, emphasizing the importance of a clear government policy on contract disclosure. Given that the last bid round for oil and gas contracts was in January 2021, there are active contracts that should be disclosed. Ecuador’s EITI reporting notes that there are 38 active oil and gas contracts, yet only ten are disclosed on the government repository. Of the pre-2021 contracts that are publicly disclosed, it appears that this disclosure includes annexes, amendments and riders, but without an inventory of which contracts are published and which are not, comprehensiveness is not able to be determined. While the comprehensiveness of disclosure of post-1 January 2021 contracts is unclear, there are newly awarded and amended contracts that are available to the public on via government publications (scroll down to “Contratos petroleros”). These disclosure practices in the hydrocarbon sector are commendable. Some petroleum contracts entered into and amended before and after 1 January 2021 are disclosed. EITI reporting lists all active petroleum contracts, though this list does not indicate which are publicly available and which are not.  

By contrast, the ARCERNNR hosts a mining register that contains what appears to be a complete list of mining licenses and contracts, although it is the Secretariat's understanding that there is no public disclosure of mining contracts or licenses, including model licenses. During the Validation mission, mining industry stakeholders expressed reservations on full contract disclosure, stating that this information could be misinterpreted or taken out of context to cast mining companies in a bad light. EITI reporting does provide a description of the general criteria applicable to different mining regimes but the mining register’s list does not touch on the public availability of these licenses. Information on large-scale mining projects in which ENAMI is involved can be found via publications on their website. Another recent large-scale mining project spearheaded by SolGold, the Cascabel Project, provides a clear precedent for companies interested in promoting transparency and anti-corruption in their mining projects. Through collaboration with local civil society groups, SolGold’s exploitation contract includes specific clauses that require adherence to the EITI Standard. However, to date, this contract has not been publicly disclosed and Ecuador MSG is invited to comment on when this contract will become publicly available. 

Given the lack of MSG discussion about what constitutes government policy on contract disclosure, and the lack of actual disclosure of mining contracts and licenses, it would be helpful for future discussions to document this policy and then document and explain any deviations from established procedure, with an explanation for why mining contracts and licenses are not disclosed and recommendations to disclose them.  "
ac_ei_contracts,Anti-Corruption,Extractives,NA,EITI Validation Data,,Extractive Industries Transparency Initiative (EITI),2025,2,Contracts and licenses,Public accessibility of all licenses and contracts underpinning extractive activities,Europe,Germany,ac_ei_03,DEU,1,Partial,Mostly met,"The International Secretariat’s assessment is that Requirement 2.4 is mostly met. The publication of contracts does not apply in Germany because there is no contracting regime. Nonetheless, the accessibility of licenses and the ability to assess deviations from model terms remains applicable. In several regions legitimate interest must be demonstrated to access licenses. Stakeholders from all constituencies noted that this does not pose a significant impediment to public understanding of the obligations of companies because key information is captured in public license registries. Nonetheless, legitimate interest restrictions mean that the objective of Requirement 2.4 is not yet fully met. 
Germany has a licensing regime for the extractive sector in which regional mining authorities do not negotiate contract terms with companies. Instead, they issue a license document (Erstbescheid) in which project-specific terms, such as the name of the license holder, license coordinates and approval and expiry dates, are documented. This information is then captured in license registries administered by regional mining authorities. All other terms of exploration and extraction are defined in federal legislation and regional regulations. License documents are based on a model license (or document), but the model license is different from region to region.
The MSG concluded that for the period under review, Requirement 2.4 of the EITI Standard is not applicable for D-EITI due to the absence of a contracting regime in the extractive sector. The International Secretariat notes that the requirement equally applies to the disclosure of extractive sector licenses.
According to the federal mining law, license documents do not need to be made publicly available unless the request is made by a person who can prove legitimate interest.  In practice, government approaches to license disclosure vary by region. D-EITI’s reporting portal provides guidance on the disclosure practice of each region. Lower Saxony, Bremen, Hamburg and Schleswig-Holstein appear to be the only regions which systematically disclose most license documents (with some gaps, particularly in the case of very old licenses).  In all other regions, legitimate interest must be demonstrated in order to gain access to these documents. BbergG does not provide a definition for what constitutes legitimate interest, and the guidance published on the D-EITI website does not explain what would be considered “legitimate interest”. The International Secretariat is not aware of any of these regions publishing a model license document in lieu of actual licenses. 
Stakeholders consulted for this Validation were of the view that the public interest restrictions are not a major impediment for understanding the obligations of companies operating in the extractive sector, as payment obligations are defined in federal and regional legislation, which is systematically disclosed. The government argued that there are no deviations in licenses from the standard clauses, but the International Secretariat is not aware that this was reviewed or assessed. License-specific information, such as license holder and duration, is recorded in the license registries administered by regional mining authorities. This information can also be downloaded from the D-EITI portal (see Requirement 2.3). "
ac_ei_contracts,Anti-Corruption,Extractives,NA,EITI Validation Data,,Extractive Industries Transparency Initiative (EITI),2025,2,Contracts and licenses,Public accessibility of all licenses and contracts underpinning extractive activities,Africa and the Middle East,Ghana,ac_ei_03,GHA,1,Partial,Mostly met,"The International Secretariat’s initial assessment is that Requirement 2.4 is mostly met. The Secretariat commends Ghana for having published all petroleum contracts and a number of contracts for mining and oil and gas through government websites, predating January 2021. As there have been new mining leases attributed since January 2021, and there may have been amendments to existing agreements, the International Secretariat’s view is that the objective of Requirement 2.4 is mostly met. In particular, for large scale mining operations and Ghana’s producing oil and gas fields, an inventory of which agreements are to be published and where to find them would be necessary to establish the comprehensiveness of disclosures on a rolling basis, in particular given that an agreement for lithium has recently been signed. The MSG’s comments on the draft Validation report argue for an upgrade in the assessment of Requirement 2.4 to ‘fully met’. The comments note that the list of active mining licenses is available through the mining cadastral portal, that mining development agreements are published on the Mining Commission’s website, and the fact that all mining licenses are pro forma, with the model license for each license type available on the Mining Commission’s website. However, while the list of active mining licenses provides a list of active licenses, it does not provide an overview of which contracts and licenses are publicly available in accordance with Requirement 2.4.c.ii. The lack of such an inventory of all active extractive licenses and contracts is a concern, since the process of indicating where each document is publicly disclosed and highlighting contracts or licenses that may not have been published yet helps improve the public accessibility of such contracts. 
For mining, several Mining Leases, in total 28, have already been published on the Minerals Commission website, predating 2021. Stakeholders consulted confirmed that there are ongoing efforts to complete the disclosures for mining development and investment agreements to complement the Mining Leases. Since January 2021, 31 new mining leases have been allocated. The inventory of all active licenses and contracts, their status, degree of amendment and place of publication is not yet available, which makes it difficult to ascertain the coverage of contracts and licenses published. Government stakeholders confirmed that, regarding mining licenses, all awarded licenses adhered to the model agreement but noted that the full text of all mining licenses are yet to be listed in the Ghana Mining Repository. Relevant government policy on license and contract disclosure in the mining sector is summarised in the 2020 GHEITI Mining Report. Efforts are underway to amend the Minerals and Mining Act to allow for full contract disclosure, thus it is even more commendable that Ghana has already published many contracts. Consulted national secretariat staff added context to these amendment efforts by noting that even with the passage of an amended Minerals and Mining Act, it will take time to digitise existing licenses and contracts given that most of them are in paper form. The 2020 GHEITI Mining Report indicates that contract disclosure policy is defined through Section 56 of Act 919. During consultations, mining industry stakeholders indicated that they were in favour of full contract disclosure but that efforts on this front must be led by government.
For oil and gas, it appears that all petroleum agreements, including amendments, annexes and riders have been published through the Ghana Petroleum Register and are publicly accessible. To note that the two companies Tullow Ghana Ltd and Kosmos Energy Ghana, which are subsidiaries of EITI supporting companies, have disclosed the contracts on their respective company websites.
In both sectors, agreements are detailed in a map view and it is not clear whether there are regularly updated lists of active mining and petroleum agreements where the public can easily see which agreements are active and publicly accessible, with specific references to each published document and an indication of whether some documents were not publicly accessible. Consulted government stakeholders in mining were unable to confirm that the list provided in the mining repository comprehensive of all active mining exploration and exploitation contracts and licenses.  While the Ghana Mining Register indicates that efforts are ongoing to publish missing mining development and investment agreements, it is not clear if there is an established plan in place to publish these agreements.
"
ac_ei_contracts,Anti-Corruption,Extractives,NA,EITI Validation Data,,Extractive Industries Transparency Initiative (EITI),2025,2,Contracts and licenses,Public accessibility of all licenses and contracts underpinning extractive activities,Americas,Guatemala,ac_ei_03,GTM,2,Yes,Fully met,The Government of Guatemala supports and practices contract transparency. Contractual arrangements in the mining sector do not exist. Oil and gas contracts are published in the official gazette and in the Ministry of Energy and Mines’ portal.
